id_news,title,date,title_label,title_score
22332792.0,columna de opinión,2021-10-25,POS,0.9340501427650452
47526969.0,columna de opinión,2021-09-24,POS,0.9340501427650452
22334896.0,Emprendedores porteños ganan concurso y anhelan abrir locales en todo el país,2021-11-27,POS,0.9748685956001282
22333422.0,columna de opinión,2021-11-18,POS,0.9340501427650452
22328484.0,"""Esta serie le hace bien a la televisión abierta, le aporta contenido, propuesta estética""",2021-09-19,POS,0.9986580610275269
22336269.0,Técnicos locales aplauden la actuación histórica de remeros en Sudamericano,2021-12-21,POS,0.9980054497718811
21427289.0,Hospital Puerto Montt se suma a las guías internacionales de buenas prácticas en enfermería RNAO,2021-11-25,POS,0.997364342212677
21378840.0,Subastas Electrónicas de Aduanas han recaudado más de $ 1.722 millones,2021-11-26,POS,0.997214138507843
47524964.0,Vecinos valoran distinción mundial que recibió el humedal Chamiza,2021-09-20,POS,0.9145215749740601
47521319.0,columna de opinión,2021-07-29,POS,0.9340501427650452
47523424.0,columna de opinión,2021-08-18,POS,0.9340501427650452
22331543.0,columna de opinión,2021-08-28,POS,0.9340501427650452
22595077.0,columna de opinión Tokio 2020,2021-08-08,POS,0.9513803720474243
47527247.0,columna de opinión,2021-09-30,POS,0.9340501427650452
47533552.0,Territorios Creativos apuesta por el teatro en todo el país durante enero,2021-12-27,POS,0.9122322797775269
47534460.0,Territorios Creativos apuesta por el teatro en todo el país durante enero,2021-12-27,POS,0.9122322797775269
47535084.0,Territorios Creativos apuesta por el teatro en todo el país durante enero,2021-12-28,POS,0.9122322797775269
21431375.0,Seremi de Desarrollo Social entrega reconocimiento a 9 adultos mayores de la región elegidos a nivel nacional dentro de los 100 líderes mayores,2021-12-22,POS,0.6599355340003967
47518727.0,"Gastronómicos vuelven a atender en locales, pero llenos de dudas",2021-07-08,POS,0.8334863781929016
47528088.0,"Se estrena en Chile la premiada cinta ""Mis hermanos sueñan despiertos""",2021-10-18,POS,0.9866255521774292
22596443.0,Vive Lago Llanquihue Destino Creativo: actividades para vivir la creatividad a lo largo de la cuenca del Lago Llanquihue,2021-11-25,POS,0.9135765433311462
22520768.0,Gran convocatoria logra la 7ª versión del Congreso de Historia del Colegio Inmaculada Concepción Puerto Varas,2021-10-13,POS,0.9945376515388489
47527184.0,"Se estrena en Chile premiada cinta ""Mis hermanos sueñan despiertos""",2021-10-18,POS,0.9853752851486206
21443362.0,Rama Femenina Puerto Varas – CEB Puerto Montt Femenino: Promesa de buen básquetbol este fin de semana,2021-11-12,POS,0.9978722333908081
22389300.0,Actividad turística regional anota alza de un 334% durante el mes de junio,2021-08-08,POS,0.9044000506401062
47521255.0,Actividad turística regional anota alza de un 334% durante el mes de junio,2021-08-07,POS,0.9044000506401062
47534363.0,"Básquetbol, ciclismo y atletismo fueron los reyes de los Juegos de la Araucanía",2021-12-11,POS,0.8024214506149292
21433025.0,Sercotec Los Lagos abre convocatorias de programa “Formalízate 2021”,2021-07-23,POS,0.636480450630188
47527067.0,Un emprendimiento da nueva vida al plástico y retoma tradición ancestral,2021-10-08,POS,0.9656693339347839
47520752.0,Califican al bote de Sanhueza-Abaroa como uno de los de mejor proyección internacional,2021-07-30,POS,0.997038722038269
22332534.0,"""ULagos se empina como la institución más consolidada en la región y el sur del país""",2021-09-21,POS,0.9978772401809692
22334924.0,Puertovarinos consolidan un soporte tecnológico para apoyar al turismo,2021-12-02,POS,0.9959122538566589
21450273.0,"En una cadena de canales de TV: “Teletón, todos los días” lanza su campaña 2021 con una niña y un niño embajadores, y un pegajoso rap",2021-09-15,POS,0.9803410768508911
21381247.0,Presentan nuevos productos que serán parte del menú escolar 2022,2021-11-19,POS,0.960125744342804
21385545.0,Proyecto de Presupuesto para la región de Los Lagos supera los 90 mil millones de pesos con un 6.8% de crecimiento,2021-10-05,POS,0.9577725529670715
22336252.0,"En Apruebo Dignidad aseguran que llegarán con ""los mejores""",2021-12-21,POS,0.998102605342865
47519030.0,Los emprendedores del turismo rural tienen todo listo para recibir a los visitantes en fase 3,2021-08-01,POS,0.9965997338294983
22333984.0,Renato Cárdenas y Rodrigo Muñoz ganan el Premio Regional de Cultural,2021-11-26,POS,0.9820050001144409
21382863.0,En Puerto Varas: Sercotec Los Lagos inauguró el nuevo centro de negocios para las PYMES de la cuenca del lago Llanquihue y Cochamó,2021-08-19,POS,0.9294857382774353
47383629.0,Localidad cordillerana a 180 kilómetros de Puerto Varas: Llanada Grande da un salto en conectividad gracias a proyecto que ilumina nuevo Centro Comunitario con Internet gratuita,2021-11-27,POS,0.9976440072059631
22330275.0,"""Me invitaron para retornar en marzo de 2022. Fue increíble lo que viví en Bélgica""",2021-10-26,POS,0.9641096591949463
22388757.0,"""Sichel y yo somos dos personas que tenemos más similitudes que diferencias""",2021-07-20,POS,0.9068238139152527
47519299.0,"""Sichel y yo somos dos personas que tenemos más similitudes que diferencias""",2021-07-20,POS,0.9068238139152527
47520635.0,Destino Osorno-Puyehue alcanza 81% de ocupación hotelera durante julio,2021-08-16,POS,0.9708018898963928
21445668.0,"La Trayectoria, el Artista Emergente y la Cultura Tradicional se reconocen en Premios Regionales de Cultura Los Lagos",2021-11-26,POS,0.6418452262878418
47526273.0,Emprendedores turísticos de Purranque se preparan para recibir visitantes esta temporada,2021-10-15,POS,0.9659798741340637
47526298.0,Gastronómicos esperanzados en reactivación tras libertad nocturna,2021-10-01,POS,0.9958431124687195
21383494.0,Alcalde de Cisnes suma voluntades con sus pares de la provincia Palena Sur en el cuidado de infraestructura crítica entre los Lagos y Aysén,2021-07-13,POS,0.9830635190010071
21383084.0,"La Trayectoria, el Artista Emergente y la Cultura Tradicional se reconocen en Premios Regionales de Cultura Los Lagos.",2021-12-06,POS,0.6944546699523926
47521358.0,Lanzan inédita campaña que busca aportar al bienestar emocional en el sur de Chile,2021-07-31,POS,0.7854207754135132
47518905.0,Lanzan inédita campaña que busca aportar al bienestar emocional en el sur de Chile,2021-07-31,POS,0.7854207754135132
21384707.0,¡Castro te quiero ver de pie…!,2021-12-10,POS,0.997314989566803
21378371.0,Jordi Valenzuela Muñoz: una apuesta joven para el Consejo Regional,2021-10-16,POS,0.998046875
